{
  "$schema": "./UiApiSpec.schema.json",
  "version": 1,
  "apiVersion": 6,
  "note": "UI 受控 API 唯一源：生成 UIBindIndex 声明 / UIBindBase 转发 / Lua shim / dispatch / 参考表 / 清单。新增 API = 改本文件 + 重生成。",
  "categories": [
    {
      "id": "text",
      "title": "文本",
      "notes": [
        "未注入语言服务时 `SetTextKey*` 抛（静默显示 key 是隐蔽故障）。",
        "同一节点只能有一个文案写者（静态 key 与动态 SetText 互斥）。"
      ]
    },
    {
      "id": "state",
      "title": "显隐/交互/数值",
      "notes": []
    },
    {
      "id": "feedback",
      "title": "提示/反馈",
      "notes": []
    },
    {
      "id": "controls",
      "title": "输入控件",
      "notes": []
    },
    {
      "id": "fx",
      "title": "动效",
      "notes": [
        "动效只写表现；页面关闭/隐藏即杀；与业务写入冲突时先 Kill。"
      ]
    },
    {
      "id": "list",
      "title": "列表",
      "notes": []
    },
    {
      "id": "bind",
      "title": "按钮绑定",
      "notes": [
        "按钮回调替换式绑定；`UnbindButton` 只解绑该控件，`OnHide` 时框架统一 `UnbindAll`。"
      ]
    }
  ],
  "methods": [
    {
      "name": "Get",
      "returns": "T",
      "generic": "T",
      "constraint": "Component",
      "params": [
        {
          "name": "name",
          "type": "string"
        }
      ],
      "summary": "按名取强类型控件；未命中 / 类型不符即抛（调试定位用）。"
    },
    {
      "name": "Has",
      "returns": "bool",
      "params": [
        {
          "name": "name",
          "type": "string"
        }
      ],
      "summary": "控件是否存在（不抛）。"
    },
    {
      "name": "BindButton",
      "returns": "void",
      "params": [
        {
          "name": "name",
          "type": "string"
        },
        {
          "name": "onClick",
          "type": "Action"
        }
      ],
      "summary": "替换式绑按钮（重绑先移除旧监听；回调经 SafeCall 隔离）。",
      "lua": [
        {
          "name": "onButton",
          "manual": true,
          "category": "bind",
          "call": [
            {
              "arg": "name",
              "field": "name",
              "kind": "passthrough"
            },
            {
              "arg": "fn",
              "field": "fn",
              "kind": "passthrough"
            }
          ],
          "doc": {
            "args": "控件名, 回调",
            "note": "替换式绑定；框架在 OnHide 统一解绑"
          }
        }
      ]
    },
    {
      "name": "UnbindButton",
      "returns": "void",
      "params": [
        {
          "name": "name",
          "type": "string"
        }
      ],
      "summary": "解绑该控件的按钮监听（不影响其它控件）。",
      "lua": [
        {
          "name": "offButton",
          "category": "bind",
          "call": [
            {
              "arg": "name",
              "field": "name",
              "kind": "string"
            }
          ],
          "doc": {
            "args": "控件名",
            "note": "只解绑该控件"
          }
        }
      ]
    },
    {
      "name": "SetText",
      "returns": "void",
      "params": [
        {
          "name": "name",
          "type": "string"
        },
        {
          "name": "value",
          "type": "string"
        }
      ],
      "summary": "命令式写文本（与 Bind 互斥；挂 LTextLabel 时走打字机）。",
      "lua": [
        {
          "name": "setText",
          "category": "text",
          "call": [
            {
              "arg": "name",
              "field": "name",
              "kind": "string"
            },
            {
              "arg": "text",
              "field": "text",
              "kind": "string"
            }
          ],
          "doc": {
            "args": "控件名, 文本",
            "note": "数据直写；不随语言刷新"
          }
        }
      ]
    },
    {
      "name": "SetTextKey",
      "returns": "void",
      "params": [
        {
          "name": "name",
          "type": "string"
        },
        {
          "name": "key",
          "type": "string"
        },
        {
          "name": "args",
          "type": "object[]",
          "params": true
        }
      ],
      "summary": "按 key 写文本；未注入语言服务即抛。",
      "lua": [
        {
          "name": "setTextKey",
          "category": "text",
          "call": [
            {
              "arg": "name",
              "field": "name",
              "kind": "string"
            },
            {
              "arg": "key",
              "field": "key",
              "kind": "string"
            }
          ],
          "doc": {
            "args": "控件名, key",
            "note": "按 key 写；语言切换自动刷新"
          }
        },
        {
          "name": "setTextKeyArgs",
          "category": "text",
          "call": [
            {
              "arg": "name",
              "field": "name",
              "kind": "string"
            },
            {
              "arg": "key",
              "field": "key",
              "kind": "string"
            },
            {
              "kind": "formatArgs"
            }
          ],
          "extraArgs": 4,
          "doc": {
            "args": "控件名, key, a0..a3",
            "note": "带参格式化（最多 4 个参数）",
            "sig": "SetTextKeyArgs(name, key, a0..a3)"
          }
        }
      ]
    },
    {
      "name": "SetTextKeyPlural",
      "returns": "void",
      "params": [
        {
          "name": "name",
          "type": "string"
        },
        {
          "name": "key",
          "type": "string"
        },
        {
          "name": "count",
          "type": "long"
        },
        {
          "name": "args",
          "type": "object[]",
          "params": true
        }
      ],
      "summary": "按 key 写文本（英文 one/other 显式复数）。",
      "lua": [
        {
          "name": "setTextKeyPlural",
          "category": "text",
          "call": [
            {
              "arg": "name",
              "field": "name",
              "kind": "string"
            },
            {
              "arg": "key",
              "field": "key",
              "kind": "string"
            },
            {
              "arg": "count",
              "field": "count",
              "kind": "count"
            },
            {
              "kind": "formatArgs"
            }
          ],
          "extraArgs": 4,
          "doc": {
            "args": "控件名, key, 复数 count, a0..a3",
            "note": "英文 one/other 显式选择",
            "sig": "SetTextKeyPlural(name, key, count, a0..a3)"
          }
        }
      ]
    },
    {
      "name": "UnbindTextKey",
      "returns": "bool",
      "params": [
        {
          "name": "name",
          "type": "string"
        }
      ],
      "summary": "解除该控件的本地化绑定（不再随语言刷新）。",
      "lua": [
        {
          "name": "unbindTextKey",
          "category": "text",
          "call": [
            {
              "arg": "name",
              "field": "name",
              "kind": "string"
            }
          ],
          "doc": {
            "args": "控件名",
            "note": "解除该控件本地化绑定"
          }
        }
      ]
    },
    {
      "name": "SetVisible",
      "returns": "void",
      "params": [
        {
          "name": "name",
          "type": "string"
        },
        {
          "name": "visible",
          "type": "bool"
        }
      ],
      "summary": "显隐（直接 SetActive）。",
      "lua": [
        {
          "name": "setVisible",
          "category": "state",
          "call": [
            {
              "arg": "name",
              "field": "name",
              "kind": "string"
            },
            {
              "arg": "visible",
              "field": "visible",
              "kind": "bool"
            }
          ],
          "doc": {
            "args": "bool",
            "note": "直接 `SetActive`"
          }
        }
      ]
    },
    {
      "name": "SetInteractable",
      "returns": "void",
      "params": [
        {
          "name": "name",
          "type": "string"
        },
        {
          "name": "on",
          "type": "bool"
        }
      ],
      "summary": "可交互开关（Selectable 优先，回退 UIWidget.Interactable）。",
      "lua": [
        {
          "name": "setInteractable",
          "category": "state",
          "call": [
            {
              "arg": "name",
              "field": "name",
              "kind": "string"
            },
            {
              "arg": "on",
              "field": "on",
              "kind": "bool"
            }
          ],
          "doc": {
            "args": "bool",
            "note": "`Selectable` 优先，回退 `UIWidget.Interactable`"
          }
        }
      ]
    },
    {
      "name": "SetProgress",
      "returns": "void",
      "params": [
        {
          "name": "name",
          "type": "string"
        },
        {
          "name": "value01",
          "type": "float"
        }
      ],
      "summary": "进度条：归一化值（0~1）。",
      "lua": [
        {
          "name": "setProgress",
          "category": "state",
          "call": [
            {
              "arg": "name",
              "field": "name",
              "kind": "string"
            },
            {
              "arg": "value",
              "field": "value",
              "kind": "float"
            }
          ],
          "doc": {
            "args": "0~1",
            "note": "进度条"
          }
        }
      ]
    },
    {
      "name": "SetProgress",
      "returns": "void",
      "params": [
        {
          "name": "name",
          "type": "string"
        },
        {
          "name": "current",
          "type": "float"
        },
        {
          "name": "max",
          "type": "float"
        }
      ],
      "summary": "进度条：当前/上限。",
      "lua": [
        {
          "name": "setProgressRange",
          "category": "state",
          "call": [
            {
              "arg": "name",
              "field": "name",
              "kind": "string"
            },
            {
              "arg": "cur",
              "field": "cur",
              "kind": "float"
            },
            {
              "arg": "max",
              "field": "max",
              "kind": "float"
            }
          ],
          "doc": {